{
  "schemaVersion": 1,
  "scope": "user",
  "source": {"kind": "https", "manifestUrl": "https://agent.example/manifest.json"},
  "stateDir": {
    "bytesBase64Url": "L2hvbWUvYWxpY2UvLmxvY2FsL3N0YXRlL2NoZWNrc3k",
    "display": "/home/alice/.local/state/checksy"
  },
  "expectedExecutor": {"uid": 1000, "gid": 1000, "username": "alice"},
  "trust": {
    "kind": "minisign",
    "keyPath": {
      "bytesBase64Url": "L2hvbWUvYWxpY2UvLmNvbmZpZy9jaGVja3N5L21pbmlzaWduLnB1Yg",
      "display": "/home/alice/.config/checksy/minisign.pub"
    },
    "keyId": "d4c85dd87ebcbf65",
    "publicKeySha256": "1111111111111111111111111111111111111111111111111111111111111111"
  },
  "policy": {
    "schemaVersion": 1,
    "privilegePolicy": {"schemaVersion": 1, "allowedRunAs": ["current"], "allowedActions": ["check", "fix"]},
    "allowedExternalRoots": [],
    "failSeverityCeiling": "error",
    "offline": {"enabled": true, "maxAge": "24h"},
    "limits": {}
  },
  "schedule": {
    "interval": "1h",
    "stdoutPath": {"bytesBase64Url": "L2hvbWUvYWxpY2UvLmxvY2FsL3N0YXRlL2NoZWNrc3kvbG9ncy9hcHBseS5zdGRvdXQubG9n", "display": "/home/alice/.local/state/checksy/logs/apply.stdout.log"},
    "stderrPath": {"bytesBase64Url": "L2hvbWUvYWxpY2UvLmxvY2FsL3N0YXRlL2NoZWNrc3kvbG9ncy9hcHBseS5zdGRlcnIubG9n", "display": "/home/alice/.local/state/checksy/logs/apply.stderr.log"}
  },
  "createdAt": "2026-07-21T00:00:00.000Z",
  "updatedAt": "2026-07-21T01:00:00.000Z"
}
