{
  "schemaVersion": 1,
  "scope": "user",
  "source": {
    "kind": "local",
    "root": {
      "bytesBase64Url": "L3Nydi9jaGVja3N5L3NvdXJjZQ",
      "display": "/srv/checksy/source"
    },
    "configPath": ".checksy.yaml"
  },
  "stateDir": {
    "bytesBase64Url": "L2hvbWUvYWxpY2UvLmxvY2FsL3N0YXRlL2NoZWNrc3k",
    "display": "/home/alice/.local/state/checksy"
  },
  "expectedExecutor": {"uid": 1000, "gid": 1000, "username": "alice"},
  "trust": {"kind": "local-operator"},
  "policy": {
    "schemaVersion": 1,
    "privilegePolicy": {
      "schemaVersion": 1,
      "allowedRunAs": ["current"],
      "allowedActions": ["check", "fix"]
    },
    "allowedExternalRoots": [],
    "failSeverityCeiling": null,
    "offline": {"enabled": true, "maxAge": "24h"},
    "limits": {}
  },
  "schedule": {
    "interval": "15m",
    "stdoutPath": {
      "bytesBase64Url": "L2hvbWUvYWxpY2UvLmxvY2FsL3N0YXRlL2NoZWNrc3kvbG9ncy9hcHBseS5zdGRvdXQubG9n",
      "display": "/home/alice/.local/state/checksy/logs/apply.stdout.log"
    },
    "stderrPath": {
      "bytesBase64Url": "L2hvbWUvYWxpY2UvLmxvY2FsL3N0YXRlL2NoZWNrc3kvbG9ncy9hcHBseS5zdGRlcnIubG9n",
      "display": "/home/alice/.local/state/checksy/logs/apply.stderr.log"
    }
  },
  "createdAt": "2026-07-21T00:00:00.000Z",
  "updatedAt": "2026-07-21T00:00:00.000Z"
}
